{
  "$schema": "https://json-schema.org/draft/2020-12/schema",
  "$id": "https://klimpaskov.github.io/hoi4-mod-setup/schemas/codex-analysis.schema.json",
  "title": "Codex Project Analysis",
  "type": "object",
  "additionalProperties": false,
  "required": [
    "schema_version",
    "analysis_id",
    "mode",
    "input_sha256",
    "project_summary",
    "proposals",
    "component_recommendations",
    "warnings"
  ],
  "properties": {
    "schema_version": {
      "type": "string",
      "const": "1.0.0"
    },
    "analysis_id": {
      "type": "string",
      "maxLength": 128
    },
    "mode": {
      "type": "string",
      "enum": [
        "new_project_identity",
        "existing_project_semantics"
      ]
    },
    "input_sha256": {
      "type": "string"
    },
    "project_summary": {
      "type": "string",
      "minLength": 1,
      "maxLength": 1200
    },
    "proposals": {
      "type": "array",
      "minItems": 10,
      "maxItems": 10,
      "items": {
        "$ref": "#/$defs/proposal"
      }
    },
    "component_recommendations": {
      "type": "array",
      "items": {
        "type": "object",
        "additionalProperties": false,
        "required": [
          "component_id",
          "recommendation",
          "reason"
        ],
        "properties": {
          "component_id": {
            "type": "string",
            "maxLength": 128,
            "pattern": "^[a-z0-9][a-z0-9._-]*$"
          },
          "recommendation": {
            "type": "string",
            "enum": [
              "required",
              "recommended",
              "not_recommended"
            ]
          },
          "reason": {
            "type": "string",
            "maxLength": 500
          }
        }
      }
    },
    "warnings": {
      "type": "array",
      "items": {
        "type": "string",
        "maxLength": 500
      }
    }
  },
  "$defs": {
    "proposal": {
      "anyOf": [
        {
          "type": "object",
          "additionalProperties": false,
          "required": [
            "key",
            "value",
            "confidence",
            "reason",
            "evidence_refs"
          ],
          "properties": {
            "key": {
              "type": "string",
              "enum": [
                "display_name",
                "project_id",
                "script_prefix",
                "primary_namespace",
                "project_description",
                "agents_profile",
                "localisation_convention",
                "documentation_convention"
              ]
            },
            "value": {
              "type": "string"
            },
            "confidence": {
              "type": "number",
              "minimum": 0,
              "maximum": 1
            },
            "reason": {
              "type": "string",
              "maxLength": 500
            },
            "evidence_refs": {
              "type": "array",
              "items": {
                "type": "string"
              }
            }
          }
        },
        {
          "type": "object",
          "additionalProperties": false,
          "required": [
            "key",
            "value",
            "confidence",
            "reason",
            "evidence_refs"
          ],
          "properties": {
            "key": {
              "type": "string",
              "enum": [
                "descriptor_tags",
                "folder_profile"
              ]
            },
            "value": {
              "type": "array",
              "items": {
                "type": "string"
              }
            },
            "confidence": {
              "type": "number",
              "minimum": 0,
              "maximum": 1
            },
            "reason": {
              "type": "string",
              "maxLength": 500
            },
            "evidence_refs": {
              "type": "array",
              "items": {
                "type": "string"
              }
            }
          }
        }
      ]
    }
  },
  "description": "Schema-constrained semantic proposals returned by the selected setup-assistant adapter; Codex uses a ChatGPT-authenticated App Server turn."
}
